Text,Category
paraguay novel wins us book prize a novel set in 19th century paraguay has won the $10 000 (£5 390) fiction prize at the us national book awards. lily tuck s the news from paraguay is a fictionalised tale about paraguayan leader francisco solano lopez and his irish mistress.,entertainment
uk economy facing  major risks  the uk manufacturing sector will continue to face  serious challenges  over the next two years  the british chamber of commerce (bcc) has said. the group s quarterly survey of companies found exports had picked up in the last three months of 2004 to their best levels in eight years.,business
saudi ncci s shares soar shares in saudi arabia s national company for cooperative insurance (ncci) soared on their first day of trading in riyadh. they were trading 84% above the offer price on monday  changing hands at 372 riyals ($99; £53) after topping 400 early in the day.,business
china suspends 26 power projects china has ordered a halt to construction work on 26 big power stations  including two at the three gorges dam  on environmental grounds. the move is a surprising one because china is struggling to increase energy supplies for its booming economy.,business
ronaldo considering new contract manchester united winger cristiano ronaldo said he is close to agreeing to a new contract at old trafford. the portugal star  who joined in august 2003 on a five-year-deal  is a regular in the united first-team.,sport
all black magic: new zealand rugby playing colours:  all black  the haka and more!  the all blacks  charles john munro discovered rugby at london s christ college  and on his return to nelson he staged new zealand s first game. nelson town met nelson college on 14 may  1870  the town triumphing by two goals to nil  instigating a game that would become a national obsession and come to dominate the country s sporting passions.,sport
england children s tsar appointed the first children s commissioner for england has been appointed. great ormond street hospital professor of child health  al aynsley-green  was chosen by the government and will start the £100 000-a-year job immediately.,politics
lib dems   bold  election policy charles kennedy has told voters his liberal democrats will offer them an  honest choice  at the next general election. with the other two big parties battling over which will impose the lowest taxes  mr kennedy is going into the looming election pledged to increase taxation.,politics
greek sprinters suspended by iaaf greek sprinters kostas kenteris and katerina thanou have been suspended after failing to take drugs tests before the athens olympics. athletics  ruling body the iaaf said explanations from the pair and their former coach as to why they missed the tests were  unacceptable .,sport
china net cafe culture crackdown chinese authorities closed 12 575 net cafes in the closing months of 2004  the country s government said. according to the official news agency most of the net cafes were closed down because they were operating illegally.,tech
bbc leads interactive bafta wins the bbc and the national theatre have led the field at this year s interactive bafta awards. the national theatre s stagework website picked up the prize for best learning as well as top factual site.,tech
italy aim to rattle england italy coach john kirwan believes his side can upset england as the six nations wooden spoon battle hots up. the two sides  both without a win  meet on 12 march at twickenham and kirwan says his side will be hoping to make the most of england s current slump.,sport
mobiles get set for visual radio the growth in the mobile phone market in the past decade has been nothing less than astonishing  but the ability to communicate on the go is not the only reason we are hooked. games  cameras and music players have all been added to our handsets in the last few years  but 2005 could see another big innovation that won t just see a change in our mobile phone habits - it might alter the way we listen to the radio.,tech
how the academy awards flourished the 77th annual academy awards are taking place on 27 february with the stars of the movie-making world once again holding their breath to discover who will be showered with the honours this year. but from humble beginnings  how did the modern day extravaganza become the behemoth it is today   how it all started the first academy awards were handed out in 1929 at a comparatively low-key dinner held at the hollywood roosevelt hotel - just over the road from their modern day home.,entertainment
baa support ahead of court battle uk airport operator baa has reiterated its support for the government s aviation expansion plans to airports throughout the country. the comments come a day ahead of a high court challenge by residents  groups and local councils to the government s white paper.,politics
no re-draft  for eu patent law a proposed european law on software patents will not be re-drafted by the european commission (ec) despite requests by meps. the law is proving controversial and has been in limbo for a year.,tech
labour s cunningham to stand down veteran labour mp and former cabinet minister jack cunningham has said he will stand down at the next election. one of the few blair-era ministers to serve under jim callaghan  he was given the agriculture portfolio when labour regained power in 1997.,politics
de niro film leads us box office film star robert de niro has returned to the top of the north american box office with his film hide and seek. the thriller shot straight to the number one spot after taking $22m (£11.7m) at the box office.,entertainment
henin-hardenne beaten on comeback justine henin-hardenne lost to elena dementieva in a comeback exhibition match in belgium on sunday for her second defeat in two days. and the belgian  who has slipped to eight in the world after struggling with a virus  faces a tough australian open title defence next month.,sport
yukos loses us bankruptcy battle a judge has dismissed an attempt by russian oil giant yukos to gain bankruptcy protection in the us. yukos filed for chapter 11 protection in houston in an unsuccessful attempt to halt the auction of its yugansk division by the russian authorities.,business
video phone help for deaf people deaf people who prefer to communicate using british sign language (bsl) could soon be having their phone conversations relayed using webcams or videophones and an interpreter. the video relay service is being piloted by the royal national institute for deaf people (rnid)  but the organisation says unless the service is provided at the same rate as voice calls it will be beyond most people s pockets.,tech
benitez issues warning to gerrard liverpool manager rafael benitez has ordered captain steven gerrard not to play down their champions league ambitions and be more positive. gerrard told the bbc liverpool were unlikely to win the trophy this year.,sport
worldcom bosses  $54m payout ten former directors at worldcom have agreed to pay $54m (£28.85m)  including $18m from their own pockets  to settle a class action lawsuit  reports say. james wareham  a lawyer representing one of the directors  told reuters the 10 had agreed to pay those who lost billions when the firm collapsed.,business
lib dems  to target stamp duty  the liberal democrats are promising to raise the stamp duty threshold if they win the general election  in a bid to court first-time house buyers. vince cable  the party s treasury spokesman  said raising the threshold to £150 000 would prevent over 400 000 home-buyers from paying the tax.,politics
singer ferguson  facing eviction  three degrees star sheila ferguson is the favourite to be evicted from itv s i m a celebrity... get me out of here on monday.,entertainment
msps hear renewed climate warning climate change could be completely out of control within several decades  the scottish environment protection agency is warning a committee of msps. experts are giving evidence on the subject to the scottish parliament s environment committee.,politics
robinson out of six nations england captain jason robinson will miss the rest of the six nations because of injury. robinson  stand-in captain in the absence of jonny wilkinson  had been due to lead england in their final two games against italy and scotland.,sport
robots learn  robotiquette  rules robots are learning lessons on  robotiquette  - how to behave socially - so they can mix better with humans. by playing games  like pass-the-parcel  a university of hertfordshire team is finding out how future robot companions should react in social situations.,tech
moya fights back for indian title carlos moya became the first man to successfully defend the chennai open title by beating four-times finalist paradorn srichaphan 3-6 6-4 7-6 (7/5). the spaniard then donated his £28 000 prize money to relief efforts for the victims of the asian tsunami.,sport
bargain calls widen softbank loss japanese communications firm softbank has widened losses after heavy spending on a new cut-rate phone service. the service  launched in december and dubbed  otoku  or  bargain   has had almost 900 000 orders  softbank said.,business
bridge could miss rest of season chelsea left-back wayne bridge could miss the rest of the season with a suspected broken ankle. the england international  24  was hurt in an innocuous challenge with alan shearer during the londoners  fa cup defeat at newcastle on sunday.,sport
mobile music challenges  ipod age  nokia and microsoft have agreed a deal to work on delivery of music to handsets  while sony ericsson has unveiled its phone walkman and motorola is working on an itunes phone. can mobile phones replace the mp3 player in your pocket  the music download market has been growing steadily since record firms embraced digital distribution.,tech
aids and climate top davos agenda climate change and the fight against aids are leading the list of concerns for the first day of the world economic forum in the swiss resort of davos. some 2 000 business and political leaders from around the globe will listen to uk prime minister tony blair s opening speech on wednesday.,business
mps tout lords replacement plan a group of mps has tried to raise the pressure on tony blair over reform to the house of lords by publishing a detailed blueprint for change. the cross-party group has unveiled a draft bill proposing a smaller second chamber in which 70% of members would be elected.,politics
safety alert as gm recalls cars the world s biggest carmaker general motors (gm) is recalling nearly 200 000 vehicles in the us on safety grounds  according to federal regulators. the national highway traffic safety administration (nhtsa) said the largest recall involves 155 465 pickups  vans and sports utility vehicles (suvs).,business
bosvelt optimistic over new deal manchester city s paul bosvelt will find out  within a month  whether he is to be offered a new one-year deal. the 34-year-old dutch midfielder is out of contract in the summer and  although his age may count against him  he feels he can play on for another season.,sport
collins to compete in birmingham world and commonwealth 100m champion kim collins will compete in the 60m at the norwich union grand prix in birmingham on 18 february. the st kitts and nevis star joins british olympic relay gold medallists jason gardener and mark lewis-francis.,sport
be careful how you code a new european directive could put software writers at risk of legal action  warns former programmer and technology analyst bill thompson. if it gets its way  the dutch government will conclude its presidency of the european union by pushing through a controversial measure that has been rejected by the european parliament  lacks majority support from national governments and will leave millions of european citizens in legal limbo and facing the possibility of court cases against them.,tech
first look at playstation 3 chip some details of the chip inside sony s playstation 3 have been revealed. sony  ibm and toshiba have released limited data about the so-called cell chip that will be able to carry out trillions of calculations per second.,tech
ailing eurodisney vows turnaround eurodisney  the european home of mickey mouse and friends  has said it will sell 253m euros (£175m; $328m) of new shares as it looks to avoid insolvency. the sale is the last part of a plan to restructure 2.4bn euros-worth of debts.,business
saudi investor picks up the savoy london s famous savoy hotel has been sold to a group combining saudi billionaire investor prince alwaleed bin talal and a unit of hbos bank. financial details of the deal  which includes the nearby simpson s in the strand restaurant  were not disclosed.,business
tories  would cut number of mps  the conservative party would cut the number of mps by about one-fifth if they were elected  tory leader michael howard has said. the plan forms part of the party s  smaller government bill   to be unveiled later this week.,politics
blair defends terror law changes the prime minister has defended measures to allow house arrest without trial  saying  several hundred  people in the uk are plotting terror attacks. the government is facing opposition from tory and lib dem mps and its own backbenchers as it prepares for the final commons debate on the changes.,politics
us interest rates increased to 2% us interest rates are to rise for the fourth time in five months  in a widely anticipated move. the federal reserve has raised its key federal funds rate by a quarter percentage point to 2% in light of mounting evidence that the us economy is regaining steam.,business
grammys honour soul star charles the memory of soul legend ray charles dominated the music world s leading music ceremony on sunday as he was given eight posthumous grammy awards. charles  who died in 2004  got honours including record and album of the year  while alicia keys and actor jamie foxx performed a musical tribute to him.,entertainment
world leaders gather to face uncertainty more than 2 000 business and political leaders from around the globe are arriving in the swiss mountain resort davos for the annual world economic forum (wef). for five days  they will discuss issues ranging from china s economic power to iraq s future after this sunday s elections.,business
ten-year tragedy of missing manic richey edwards  guitarist and lyricist for the manic street preachers  vanished 10 years ago  on 1 february 1995. his disappearance remains one of the most tragic mysteries in rock music.,entertainment
bortolami predicts dour contest italy skipper marco bortolami believes saturday s six nations contest against scotland will be a scrappy encounter. with both sides looking for their first win of the championship  the third-round game at murrayfield has been billed as a wooden-spoon decider.,sport
england given tough sevens draw england will have to negotiate their way through a tough draw if they are to win the rugby world cup sevens in hong kong next month. the second seeds have been drawn against samoa  france  italy  georgia and chinese taipei.,sport
youssou n dour wins music prize senegalese musician youssou n dour has been named a winner of a bbc radio 3 world music award. his album egypt won the critics  award for album of the year  while the best newcomer accolade went to argentine chango spasiuk.,entertainment
actor scott is new bond favourite bookmaker william hill has stopped taking bets on who will be the next james bond  following a succession of large wagers on actor dougray scott. the firm closed the book on friday  saying  insider information  could have contributed to the number of bets.,entertainment
troubled marsh under sec scrutiny the us stock market regulator is investigating troubled insurance broker marsh & mclennan s shareholder transactions  the firm has said. the securities and exchange commission has asked for information about transactions involving holders of 5% or more of the firm s shares.,business
uk s  useless  quangos under fire the uk has 529 quangos financed with billions of pounds of taxpayers  cash - many of which are useless or duplicate each other s efforts  a report claims. essential guide to british quangos 2005 author dan lewis said at least 111 of the appointed bodies had been set up since labour won power in 1997.,politics
us ahold suppliers face charges us prosecutors have charged nine food suppliers with helping dutch retailer ahold inflate earnings by more than $800m (£428m). the charges have been brought against individuals as well as companies  alleging they created false accounts.,business
dutch watch van gogh s last film the last film to be made by the slain dutch director theo van gogh  called 06/05  has been premiered in the hague. members of van gogh s family and celebrities attended the screening of 06/05  based on the murder of the anti-immigration politician pim fortuyn.,entertainment
henman overcomes rival rusedski tim henman saved a match point before fighting back to defeat british rival greg rusedski 4-6 7-6 (8-6) 6-4 at the dubai tennis championships on tuesday. world number 46 rusedski broke in the ninth game to take a tight opening set.,sport
wi-fi web reaches farmers in peru a network of community computer centres  linked by wireless technology  is providing a helping hand for poor farmers in peru. the pilot scheme in the huaral valley  80 kilometres north of the capital lima  aims to offer the 6 000-strong community up-to-date information on agricultural market prices and trends.,tech
us box office set for record high ticket sales at the us box office are predicted to break records this year  with figures expected to reach $9.4 billion  beating 2002 s all-time high. overall figures could be dampened by the lack of a christmas hit like last year s oscar-winning lord of the rings.,entertainment
players sought for $1m prize uk gamers are getting a chance to take part in a $1m tournament thanks to one of the country s top teams. the four-kings clan is staging a pop idol type competition to find new members who can take on the world s best in the lucrative tournament.,tech
spike lee backs student directors film-maker spike lee says black representation is stronger than ever in cinema and tv but the true power in entertainment lies behind the camera. the she hate me director urged students at his old atlanta university  morehouse college  to seek  gatekeeper positions  behind the scenes.,entertainment
senior fannie mae bosses resign the two most senior executives at us mortgage giant fannie mae have resigned after accounting irregularities were uncovered at the company. chief executive franklin raines  a former senior official in the clinton administration  and chief financial officer tim howard have left the firm.,business
piero gives rugby perspective bbc sport unveils its new analysis tool piero at the wales v england rugby union match on saturday. but what does it do and how does it work   picture the scene - wales are camped on the england line in the dying seconds of the six nations  opening match.,tech
bets off after big brother  leak  a bookmaker has stopped taking bets on celebrity big brother after claiming  sensitive information  about the channel 4 show had been leaked. william hill made the move after four people tried to place bets on friday s surprise double eviction.,entertainment
economy  strong  in election year uk businesses are set to prosper during the next few months - but this could trigger more interest rate rises  according to a report. optimism is at its highest since 1997 and business will reap the benefits of a continuing rise in public spending  say researchers at bdo stoy hayward.,business
further rise in uk jobless total the uk s jobless total rose for the second month in a row in december  official figures show. the number of people out of work rose 32 000 to 1.41 million in the last three months of 2004  even as 90 000 more people were in employment.,business
deutsche attacks yukos case german investment bank deutsche bank has challenged the right of yukos to claim bankruptcy protection in the us. in a court filing on tuesday  it said the russian oil giant has few texas ties beyond bank accounts and a texas-based finance chief.,business
disney settles disclosure charges walt disney has settled charges from us federal regulators that it failed to disclose how family members of directors were employed by the company. the media giant was not fined by the securities and exchange commission  but has agreed to refrain from any future violations of securities law.,business
duran duran show set for us tv chart stars duran duran are to appear in a vh1 special in the us including interviews and concert footage. the show airs on tuesday and will feature a studio performance  behind the scenes footage and fan interviews.,entertainment
casual gaming to  take off  games aimed at  casual players  are set to be even bigger in 2005  according to industry experts. easy-to-play titles that do not require too much time and that are playable online or downloadable to mobile devices will see real growth in the coming year.,tech
microsoft gets the blogging bug software giant microsoft is taking the plunge into the world of blogging. it is launching a test service to allow people to publish blogs  or online journals  called msn spaces.,tech
broadband challenges tv viewing the number of europeans with broadband has exploded over the past 12 months  with the web eating into tv viewing habits  research suggests. just over 54 million people are hooked up to the net via broadband  up from 34 million a year ago  according to market analysts nielsen/netratings.,tech
pop band busted to  take a break  chart-topping pop band busted have confirmed that they plan to  take a break   following rumours that they were on the verge of splitting. a statement from the band s record company universal said frontman charlie simpson planned to spend some time working with his other band  fightstar.,entertainment
call for action on internet scam phone companies are not doing enough to warn customers about internet  rogue-dialling  scams  according to premium phone line regulator icstis. it has received 45 000 complaints in recent months about dial-up internet connections diverting to premium rate numbers without users  knowledge.,tech
llewellyn plans wales retirement wales record cap holder gareth llewellyn will retire from test rugby at the end of the six nations. the veteran lock  who is 36 at the end of february  told bbc wales scrum v that it is time for him to bring down the curtain on his 92-cap wales career.,sport
new harry potter tops book chart harry potter and the half-blood prince has topped amazon s book chart less than 24 hours after its release date - 16 july - was announced. thousands of customers placed pre-orders on the amazon.co.uk website for the sixth book in the series.,entertainment
councils  must find gypsy sites  ministers are telling councils to find more sites for travellers  amid continuing rows concerning a string of unauthorised encampments. councils are also to be given stronger powers to move on illegal settlements by gypsy communities on rural land.,politics
lifestyle  governs mobile choice  faster  better or funkier hardware alone is not going to help phone firms sell more handsets  research suggests. instead  phone firms keen to get more out of their customers should not just be pushing the technology for its own sake.,tech
shares hit by ms drug suspension shares in elan and biogen idec plunged on monday as the firms suspended sales of new multiple sclerosis drug tysabri after a patient s death in the us. on the new york stock exchange  shares in ireland-based elan lost 70% while us partner biogen idec shed 43%.,business
davenport hits out at wimbledon world number one lindsay davenport has criticised wimbledon over the issue of equal prize money for women. reacting to a disputed comment by all england club chairman tim phillips  the american said:  i think it is highly insulting if prize money is taken away.,sport
pupils to get anti-piracy lessons lessons on music piracy and copyright issues are to be taught to secondary school pupils in the uk. the lessons  aimed at 11 to 14-year-olds  will introduce them to copyright - including the issues of downloading from the internet and the illegal copying of cds - and its role in protecting creativity.,entertainment
dundee utd 4-1 aberdeen dundee united eased into the semi-final of the scottish cup with an emphatic win over aberdeen. alan archibald prodded united ahead in 19 minutes and james grady made it two from close range 10 minutes later.,sport
honour for uk games maker leading british computer games maker peter molyneux has been made an obe in the new year honours list. the head of surrey s lionhead studios was granted the honour for services to the computer games industry.,tech
google to scan famous libraries the libraries of five of the world s most important academic institutions are to be digitised by google. scanned pages from books in the public domain will then be made available for search and reading online.,tech
s korea spending boost to economy south korea will boost state spending next year in an effort to create jobs and kick start its sputtering economy. it has earmarked 100 trillion won ($96bn) for the first six months of 2005  60% of its total annual budget.,business
blind student  hears in colour  a blind student has developed software that turns colours into musical notes so that he can read weather maps. victor wong  a graduate student from hong kong studying at cornell university in new york state  had to read coloured maps of the upper atmosphere as part of his research.,tech
