Text,Category
have hackers recruited your pc  more than one million computers on the net have been hijacked to attack websites and pump out spam and viruses. the huge number was revealed by security researchers who have spent months tracking more than 100 networks of remotely-controlled machines.,tech
bank payout to pinochet victims a us bank has said it will donate more than $8m to victims of former chilean military ruler augusto pinochet s regime under a madrid court settlement. riggs bank will put money in a special fund to be managed by a madrid-based charity  the salvador allende foundation  which helps abused victims.,business
apple sues  tiger  file sharers apple has taken more legal action to stop online leaks of its new products. the computer giant has sued three men for releasing preview versions of its latest mac osx software onto file-sharing sites prior to its release.,tech
jobs growth still slow in the us the us created fewer jobs than expected in january  but a fall in jobseekers pushed the unemployment rate to its lowest level in three years. according to labor department figures  us firms added only 146 000 jobs in january.,business
film row over pirates  cannibals  plans to portray dominica s carib indians as cannibals in the sequel to hit film pirates of the caribbean have been criticised by the group s chief. carib chief charles williams said talks with disney s producers revealed there was  a strong element of cannibalism in the script which cannot be removed .,entertainment
west end to honour finest shows the west end is honouring its finest stars and shows at the evening standard theatre awards in london on monday. the producers  starring nathan lane and lee evans  is up for best musical at the ceremony at the national theatre.,entertainment
prime minister s questions so who  if anyone  is playing politics with the security of the nation   michael howard has no doubt it is the prime minister who  he claims  is  ramming  through parliament the controversial new anti-terror measures without proper debate. he didn t say so  but the tories believe the prime minister is playing the fear card on this one so he can look tough in the run up to the general election and they believe tony blair is using the issue to suggest the tories are soft on terrorism.,politics
sydney to host north v south game sydney will host a northern versus southern hemisphere charity match in june or july  the australian rugby union (aru) said on wednesday. the match will include players from the lions tour of new zealand.,sport
stars pay tribute to actor davis hollywood stars including spike lee  burt reynolds and oscar nominee alan alda have paid tribute to actor ossie davis at a funeral in new york. veteran star ossie davis  a well-known civil rights activist  died in miami at the age of 87 on 4 february 2005.,entertainment
bbc  should allow more scrutiny  mps have urged the bbc to give watchdogs more freedom to scrutinise how £2bn in licence fee money is spent. the public accounts committee called for the national audit office to be given a  free hand  to investigate how the bbc offers value for money.,entertainment
games maker fights for survival one of britain s largest independent game makers  argonaut games  has been put up for sale. the london-based company behind the harry potter games has sacked about 100 employees due to a severe cash crisis.,tech
hi-tech posters guide commuters interactive posters are helping londoners get around the city during the festive season. when interrogated with a mobile phone  the posters pass on a number that people can call to get information about the safest route home.,tech
eu software patent law faces axe the european parliament has thrown out a bill that would have allowed software to be patented. politicians unanimously rejected the bill and now it must go through another round of consultation if it is to have a chance of becoming law.,tech
us adds more jobs than expected the us economy added 337 000 jobs in october - a seven-month high and far more than wall street expectations. in a welcome economic boost for newly re-elected president george w bush  the labor department figures come after a slow summer of weak jobs gains.,business
blog reading explodes in america americans are becoming avid blog readers  with 32 million getting hooked in 2004  according to new research. the survey  conducted by the pew internet and american life project  showed that blog readership has shot up by 58% in the last year.,tech
games help you  learn and play   god games  in which players must control virtual people and societies could be educational  says research. a us researcher has suggested that games such as the sims could be a good way to teach languages.,tech
south african car demand surges car manufacturers with plants in south africa  including bmw  general motors  toyota and volkswagen  have seen a surge in demand during 2004. new vehicle sales jumped 22% to 449 603 from a year earlier  the national association of automobile manufacturers of south africa (naamsa) said.,business
castaignede fires laporte warning former france fly-half thomas castaignede has warned the pressure is mounting on coach bernard laporte following their defeat by wales. france suffered a shock loss against the welsh at the weekend after looking on course for an easy win.,sport
progress on new internet domains by early 2005 the net could have two new domain names. the .post and .travel net domains have been given preliminary approval by the net s administrative body.,tech
straw to attend auschwitz service foreign secretary jack straw will visit auschwitz for the 60th anniversary of the former nazi concentration camp s liberation  it has been announced. prince edward will also join the uk delegation in poland for national holocaust memorial day on 27 january.,politics
musical treatment for capra film the classic film it s a wonderful life is to be turned into a musical by the producer of the controversial hit show jerry springer - the opera. frank capra s 1946 movie starring james stewart  is being turned into a £7m musical by producer jon thoday.,entertainment
giving financial gifts to children your child or grandchild may want the latest toy this christmas  but how about giving them a present that will help their financial future   gifts of the financial variety might have a longer lasting impact. it may encourage children to save or start a fund which could count towards university costs  for example.,business
davies favours gloucester future wales hooker mefin davies is likely to stay with english side gloucester despite reported interest from the neath-swansea ospreys. bbc wales understands the ospreys are interested in the 32-year-old  but that he would prefer to stay where he is.,sport
ad firm wpp s profits surge 15% uk advertising giant wpp has posted larger-than-expected annual profits and predicted that it will outperform the market in 2005. pre-tax profits rose 15% from a year ago to reach £546m ($1.04bn)  ahead of average analysts  forecasts of £532m.,business
tarantino to direct csi episode film director quentin tarantino is to direct an episode of us television series csi: crime scene investigation. the oscar-winning pulp fiction director has also written an original story for the season finale episode.,entertainment
blues slam blackburn over savage birmingham have confirmed blackburn made a bid for robbie savage - but managing director karen brady has called it  derisory . rovers have reportedly offered £500 000 up front for the wales star  30  with the fee rising to £2.2m.,sport
funding cut hits wales students the wales students rugby side has become a casualty of the welsh rugby union s reorganisation at youth level. an amalgamated under-18 side formed from separate schools and national youth teams plays its first match on thursday  against italy at the gnoll.,sport
roddick into san jose final andy roddick will play cyril saulnier in the final of the sap open in san jose on sunday. the american top seed and defending champion overcame germany s tommy haas  the third seed  7-6 (7-3) 6-3.,sport
us retail sales surge in december us retail sales ended the year on a high note with solid gains in december  boosted by strong car sales. seasonally adjusted sales rose 1.2% in the month  compared to 0.1% a month earlier  boosted by a surge in shopping just before and after christmas.,business
ultimate game  award for doom 3 sci-fi shooter doom 3 has blasted away the competition at a major games ceremony  the golden joystick awards. it was the only title to win twice  winning ultimate game of the year and best pc game at the awards  presented by little britain star matt lucas.,tech
will the budget bring out smiling voters  as tory spokesman oliver letwin said - any chancellor would use his pre-election budget to offer some vote winning sweeteners  wouldn t he. and everyone does  indeed  expect gordon brown to do just that in his last budget before the expected polling day of 5 may.,politics
indonesia  declines debt freeze  indonesia no longer needs the debt freeze offered by the paris club group of creditors  economics minister aburizal bakrie has reportedly said. indonesia  which originally accepted the debt moratorium offer  owes the paris club about $48bn (£25.5bn).,business
no more concessions  on terror charles clarke says he has  no desire  to offer more concessions on his controversial anti-terror plans to get them on to the statute book. mps voted in favour of the prevention of terrorism bill after mr clarke agreed to key changes - but labour s majority was reduced to 14.,politics
goldsmith denies war advice claim the attorney general has denied his statement to parliament about the legality of the iraq war was drafted by downing street officials. lord goldsmith said lord falconer and baroness morgan played no part in drafting the answer.,politics
crisis  ahead in social sciences  a national body designed to tackle skills shortages in key subjects should be set up  a committee of mps has said. there was an  absolute crisis  in the recruitment of statisticians and other social science experts  the commons science and technology committee added.,politics
mogul wilson backing uk rap band tony wilson  the music mogul who established the influential factory records in the 1980s  is to launch a new label - convinced he has discovered his  third major band . factory were the label of both joy division - who became new order after singer ian curtis committed suicide - and the happy mondays.,entertainment
wenger offers mutu hope arsenal boss arsene wenger would consider signing adrian mutu once the striker has served his drugs ban. mutu was sacked by chelsea on friday after testing positive for cocaine - a move wenger has backed.,sport
february poll claim  speculation  reports that tony blair is planning a snap general election for february 2005 have been described as  idle speculation  by downing street. a spokesman said he had  no idea  where the reports in the sunday times and sunday telegraph had come from.,politics
dollar hovers around record lows the us dollar hovered close to record lows against the euro on friday as concern grows about the size of the us budget deficit. analysts predict that the dollar will remain weak in 2005 as investors worry about the state of the us economy.,business
us tv host clark suffers stroke veteran us television host dick clark is in hospital in los angeles after suffering a mild stroke. the 75-year-old presented long-running show american bandstand from 1956-87 and has since hosted game shows and produced award ceremonies.,entertainment
no uk premiere for rings musical the producers behind the lord of the rings musical have abandoned plans to premiere the show in london because no suitable theatre was available. the £11.5m show will make its debut in toronto in march 2006  after it was found that all three west end theatres with sufficient capacity were booked.,entertainment
blair stresses prosperity goals tony blair says his party s next manifesto will be  unremittingly new labour  and aimed at producing  personal prosperity for all . the prime minister is trying to draw a line under speculation over the state of his relationship with gordon brown with the speech in chatham  kent.,politics
bush website blocked outside us surfers outside the us have been unable to visit the official re-election site of president george w bush. the blocking of browsers sited outside the us began in the early hours of monday morning.,tech
tough rules for ringtone sellers firms that flout rules on how ringtones and other mobile extras are sold could be cut off from all uk phone networks. the rules allow offenders to be cut off if they do not let consumers know exactly what they get for their money and how to turn off the services.,tech
huge rush for jet airways shares indian airline jet airways  initial public offering was oversubscribed 16.2 times  bankers said on friday. over 85% of the bids were at the higher end of the price range of 1 050-1 125 rupees ($24-$26).,business
millions to miss out on the net by 2025  40% of the uk s population will still be without internet access at home  says a study. around 23 million britons will miss out on a wide range of essential services such as education and medical information  predicts the report by telecoms giant bt.,tech
parker misses england clash tom shanklin will start in the centre for wales against england in cardiff on saturday after sonny parker failed to recover from a trapped neck nerve. shanklin was first-choice wing in the autumn tests  but prefers centre and will face england debutant mathew tait.,sport
uefa approves fake grass uefa says it will allow european matches to be played on artificial pitches from the start of next season. european football s governing body made the decision at a meeting of its executive committee on wednesday.,sport
elvis set to top uk singles chart rock  n  roll legend elvis is set to top the uk singles chart on sunday  27 years after his death. the re-release of hit song jailhouse rock was out-selling x factor winner steve brockstein s cover of against all odds by 2 000 copies on tuesday.,entertainment
desailly backs blues revenge trip marcel desailly insists there is no chance of history repeating itself when chelsea take on barcelona on wednesday. the french star was part of the chelsea side crushed 5-1 at the nou camp in the champions league quarter-final second leg in 2000.,sport
johnson announces june retirement former england captain martin johnson has announced he is to retire from rugby union at the end of the season. johnson  who captained england to world cup glory in 2003  will play his final match in june.,sport
gerrard plays down european hopes steven gerrard has admitted that liverpool have little chance of winning the champions league this season. the 24-year-old reds skipper spoke out ahead of tuesday s first leg at home to bayer leverkusen in the last 16  which he will miss through suspension.,sport
observers to monitor uk election ministers will invite international observers to check the forthcoming uk general election is fairly run. the move comes amid claims the poll could be marred by electoral fraud.,politics
ultimate game  award for doom 3 sci-fi shooter doom 3 has blasted away the competition at a major games ceremony  the golden joystick awards. it was the only title to win twice  winning ultimate game of the year and best pc game at the awards  presented by little britain star matt lucas.,tech
mobile gaming takes off in india gaming on the move is one of the fastest-growing activities among the tech-savvy in india  says a report. the indian mobile gaming market is expected to generate about $26m (£13.8m) by the end of 2004  according to market analysts in-stat/mdr.,tech
terror suspects face house arrest uk citizens suspected of involvement in terrorism could face house arrest as part of a series of new measures outlined by the home secretary. it comes after law lords ruled that the detention of 12 foreign terror suspects without trial breached human rights.,politics
eu referendum question unveiled the question to be asked in the referendum on the eu constitution has been unveiled by the government. it will be:  should the united kingdom approve the treaty establishing a constitution for the european union   the constitution will be incorporated into uk law if there is a yes vote in the referendum  expected in 2006.,politics
iraqi voters turn to economic issues beyond the desperate security situation in iraq lies an economy in tatters. a vicious cycle of unemployment  poor social services and poverty has been made worse by a lack of investment.,business
mci shareholder sues to stop bid a shareholder in us phone firm mci has taken legal action to halt a $6.75bn (£3.6bn) buyout by telecoms giant verizon  hoping to get a better deal. the lawsuit was filed on friday after qwest communications  which had an earlier offer for mci rejected  said it would submit an improved bid.,business
holmes urged to compete at worlds jolanda ceplak has urged britain s kelly holmes to continue competing at the major championships. double olympic gold medallist holmes has strongly hinted she will not run in this year s worlds and is undecided about next month s european indoors.,sport
podcasts mark rise of diy radio an apple ipod or other digital music players can hold anything up to 10 000 songs  which is a lot of space to fill. but more and more ipod owners are filling that space with audio content created by an unpredictable assortment of producers.,tech
britons fed up with net service a survey conducted by pc pro magazine has revealed that many britons are unhappy with their internet service. they are fed up with slow speeds  high prices and the level of customer service they receive. 17% of readers have switched suppliers and a further 16% are considering changing in the near future.,tech
chepkemei hit by big ban kenya s athletics body has suspended two-time london marathon runner-up susan chepkemei from all competition until the end of the year. athletics kenya (ak) issued the ban after chepkemei failed to turn up for a cross country training camp in embu.,sport
last star wars  not for children  the sixth and final star wars movie may not be suitable for young children  film-maker george lucas has said. he told us tv show 60 minutes that revenge of the sith would be the darkest and most violent of the series.,entertainment
greek pair attend drugs hearing greek sprinters kostas kenteris and katerina thanou have appeared before an independent tribunal which will decide if their bans should stand. they were given provisional suspensions by athletics  ruling body the iaaf in december for failing to take drugs tests before the athens olympics.,sport
baghdad blogger on big screen a film based on the internet musings of the  baghdad blogger  has been shown at the rotterdam film festival. the film has been directed by the man who calls himself salam pax  the author of the weblog about iraqi life during and after the war.,entertainment
georgia plans hidden asset pardon georgia is offering a one-off  tax amnesty  to people who hid their earnings under the regime of former president eduard shevardnadze. the country s new president  mikhail saakashvili  has said that anyone now willing to disclose their wealth will only have to pay 1% in income tax.,business
more women turn to net security older people and women are increasingly taking charge of protecting home computers against malicious net attacks  according to a two-year study. the number of women buying programs to protect pcs from virus  spam and spyware attacks rose by 11.2% each year between 2002 and 2004.,tech
blair  said he would stand down  tony blair promised gordon brown he would stand down before the next election  a new book about the chancellor claims. but the prime minister changed his mind following intervention from allies in the cabinet  according to the book.,politics
doors open at biggest gadget fair thousands of technology lovers and industry experts have gathered in las vegas for the annual consumer electronics show (ces). the fair showcases the latest technologies and gadgets that will hit the shops in the next year.,tech
moya clinches cup for spain spain won the davis cup for the second time in their history when carlos moya beat the usa s andy roddick in the fourth rubber in seville. moya won 6-2 7-6 (7-1) 7-6 (7-5) to give the hosts an unassailable 3-1 lead with only one singles rubber remaining.,sport
could yukos be a blessing in disguise  other things being equal  the notion of entrepreneurs languishing in jail while their companies are sold off for a song ought to be bad for business. but in the looking-glass world of modern russia  the opposite might just be true  a new report* has argued.,business
fa probes crowd trouble the fa is to take action after trouble marred wednesday s carling cup tie between chelsea and west ham. police in riot gear were confronted by a section of the west ham support after the match which the blues won 1-0.,sport
india s deccan gets more planes air deccan has signed a deal to acquire 36 planes from avions de transport regional (atr). the value of the deal has not been revealed  because of a confidentiality clause in the agreement.,business
actress roberts takes spider role actress julia roberts will play the part of a spider in a new film version of children s classic charlotte s web. she will voice charlotte  who teams up with a girl to save their friend wilbur the pig  in the story by eb white.,entertainment
us peer-to-peer pirates convicted the first convictions for piracy over peer-to-peer networks have been handed down in the us. new yorker william trowbridge and texan michael chicoine have pleaded guilty to charges that they infringed copyright by illegally sharing music  movies and software.,tech
mixed signals from french economy the french economy picked up speed at the end of 2004  official figures show - but still looks set to have fallen short of the government s hopes. according to state statistics body insee  growth for the three months to december was a seasonally-adjusted 0.7-0.8%  ahead of the 0.6% forecast.,business
chepkemei joins edinburgh line-up susan chepkemei has decided she is fit enough to run in next month s great edinburgh international cross country. the kenyan was initially unsure if she would have recovered from her gruelling tussle with paula radcliffe in the new york marathon in time to compete.,sport
dollar hits new low versus euro the us dollar has continued its record-breaking slide and has tumbled to a new low against the euro. investors are betting that the european central bank (ecb) will not do anything to weaken the euro  while the us is thought to favour a declining dollar.,business
campbell to extend sprint career darren campbell has set his sights on running quicker than ever after deciding not to retire from sprinting. campbell  who won olympic 4x100m relay gold  had been unsure about his future.,sport
souped-up wi-fi is on the horizon super high-speed wireless data networks could soon be in use in the uk. the government s wireless watchdog is seeking help on the best way to regulate the technology behind such networks called ultra wideband (uwb).,tech
deutsche boerse set to  woo  lse bosses of deutsche boerse and the london stock exchange are to meet amid talk that a takeover bid for the lse will be raised to £1.5bn ($2.9bn). last month  the german exchange tabled a 530 pence-per-share offer for lse  valuing it at £1.3bn.,business
us crude prices surge above $53 us crude prices have soared to fresh four-month highs above $53 in the us as refinery problems propelled petrol prices to an all-time high. us light sweet crude futures jumped to $53.09 a barrel in new york before closing at $53.03.,business
fannie mae  should restate books  us mortgage company fannie mae should restate its earnings  a move that is likely to put a billion-dollar dent in its accounts  watchdogs have said. the securities & exchange commission accused fannie mae of using techniques that  did not comply in material respects  with accounting standards.,business
mourinho takes swipe at arsenal chelsea boss jose mourinho has attempted to pile the pressure on title rivals arsenal ahead of the gunners facing newcastle on wednesday. arsenal will play the magpies a day after chelsea beat portsmouth during a busy festive programme.,sport
steel firm  to cut  45 000 jobs mittal steel  one of the world s largest steel producers  could cut up to 45 000 jobs over the next five years  its chief executive has said. the netherlands-based company is due to complete its $4.5bn acquisition of us firm isg next month  making it one of the largest global firms of its kind.,business
capriati to miss melbourne jennifer capriati has become the third leading lady to withdraw from the australian open because of injury. the organisers of the first grand slam of 2005  which begins on 17 january  said the american has a problem with her right shoulder.,sport
milburn defends poster campaign labour s election chief alan milburn has defended his party s campaign posters amid tory claims the ads were nothing short of  sly anti-semitism . mr milburn said he appreciated people s concerns  but insisted that  what they were was anti-tory  and  not in any way  shape or form anti-semitic .,politics
rank  set to sell off film unit  leisure group rank could unveil plans to demerge its film services unit and sell its media business  reports claim. rank  formerly famous for the carry on series  will expose the shake-up at the announcement of its results on friday  the sunday telegraph reported.,business
